{
  "schemaVersion": 1,
  "lessonId": "M01-L003",
  "title": "Fallback Thai Lesson",
  "objective": "Provide a deterministic starter lesson artifact pack.",
  "context": {
    "schemaVersion": 1,
    "lessonId": "M01-L003",
    "priorLessons": [
      "M01-L001",
      "M01-L002"
    ],
    "knownVocabulary": [
      {
        "thai": "สวัสดี",
        "translit": "sà-wàt-dii",
        "english": "hello",
        "vocabId": "v-c9337e2739"
      },
      {
        "thai": "ขอบคุณ",
        "translit": "khàawp-khun",
        "english": "thank you",
        "vocabId": "v-217b46aa5a"
      },
      {
        "thai": "ครับ",
        "translit": "khráp",
        "english": "male polite ending",
        "vocabId": "v-a34b9ddfd4"
      },
      {
        "thai": "ค่ะ",
        "translit": "khâ",
        "english": "female statement ending",
        "vocabId": "v-e5c357ab24"
      },
      {
        "thai": "คะ",
        "translit": "khá",
        "english": "female question ending",
        "vocabId": "v-8637eb381c"
      },
      {
        "thai": "ขอโทษ",
        "translit": "khǎaw-thôot",
        "english": "excuse me / sorry",
        "vocabId": "v-6fce5e8c2c"
      },
      {
        "thai": "ไม่เข้าใจ",
        "translit": "mâi khâo-jai",
        "english": "I do not understand",
        "vocabId": "v-4dea1cee34"
      },
      {
        "thai": "พูดช้าๆ ได้ไหม",
        "translit": "phûut cháa-cháa dâai mái",
        "english": "can you speak slowly?",
        "vocabId": "v-6f22c219d9"
      },
      {
        "thai": "ไก่",
        "translit": "gài",
        "english": "chicken",
        "vocabId": "v-7ec5a304ff"
      },
      {
        "thai": "ไข่",
        "translit": "khài",
        "english": "egg",
        "vocabId": "v-3a8e5a9794"
      },
      {
        "thai": "ใกล้",
        "translit": "glâi",
        "english": "near",
        "vocabId": "v-994dd77a8a"
      },
      {
        "thai": "ไกล",
        "translit": "glǎi",
        "english": "far",
        "vocabId": "v-3dcaa4dbf9"
      },
      {
        "thai": "ขา",
        "translit": "khǎa",
        "english": "leg",
        "vocabId": "v-ec4de59e6d"
      },
      {
        "thai": "ค่า",
        "translit": "khâa",
        "english": "value / fee",
        "vocabId": "v-33caa947af"
      }
    ],
    "knownGrammar": [
      "Feel how contour shifts semantic category.",
      "Lock in short/long vowel distinction.",
      "Recover conversation when comprehension drops.",
      "Request slower speech without breaking politeness.",
      "Teach pragmatic greeting and gratitude with politeness particles.",
      "Train ear to hear aspirated vs unaspirated initials."
    ],
    "reviewBuckets": [
      {
        "bucket": "last",
        "offset": 1,
        "lessonId": "M01-L002",
        "vocabIds": [
          "v-7ec5a304ff",
          "v-3a8e5a9794",
          "v-994dd77a8a",
          "v-3dcaa4dbf9"
        ],
        "sample": [
          {
            "thai": "ไก่",
            "translit": "gài",
            "english": "chicken",
            "vocabId": "v-7ec5a304ff"
          },
          {
            "thai": "ไข่",
            "translit": "khài",
            "english": "egg",
            "vocabId": "v-3a8e5a9794"
          },
          {
            "thai": "ใกล้",
            "translit": "glâi",
            "english": "near",
            "vocabId": "v-994dd77a8a"
          },
          {
            "thai": "ไกล",
            "translit": "glǎi",
            "english": "far",
            "vocabId": "v-3dcaa4dbf9"
          }
        ]
      },
      {
        "bucket": "minus3",
        "offset": 3,
        "lessonId": null,
        "vocabIds": [],
        "sample": []
      },
      {
        "bucket": "minus6",
        "offset": 6,
        "lessonId": null,
        "vocabIds": [],
        "sample": []
      },
      {
        "bucket": "minus8",
        "offset": 8,
        "lessonId": null,
        "vocabIds": [],
        "sample": []
      }
    ]
  },
  "sections": [
    {
      "id": "s1",
      "heading": "Greeting",
      "purpose": "Baseline politeness entry",
      "spokenNarration": [
        "Use สวัสดี sà-wàt-dii to open politely."
      ],
      "onScreenBullets": [
        "สวัสดี | sà-wàt-dii | hello"
      ],
      "drills": [
        "Repeat greeting with confidence."
      ],
      "languageFocus": [
        {
          "thai": "สวัสดี",
          "translit": "sà-wàt-dii",
          "english": "hello",
          "vocabId": "v-c9337e2739"
        }
      ]
    },
    {
      "id": "s2",
      "heading": "Thanks",
      "purpose": "Baseline gratitude",
      "spokenNarration": [
        "Use ขอบคุณ khàawp-khun to close politely."
      ],
      "onScreenBullets": [
        "ขอบคุณ | khàawp-khun | thank you"
      ],
      "drills": [
        "Say thanks with polite ending."
      ],
      "languageFocus": [
        {
          "thai": "ขอบคุณ",
          "translit": "khàawp-khun",
          "english": "thank you",
          "vocabId": "v-217b46aa5a"
        },
        {
          "thai": "ขอโทษ",
          "translit": "khǎaw-thôot",
          "english": "excuse me / sorry",
          "vocabId": "v-6fce5e8c2c"
        }
      ]
    },
    {
      "id": "s3",
      "heading": "Repair",
      "purpose": "Basic repair phrase",
      "spokenNarration": [
        "Use ไม่เข้าใจ mâi khâo-jai when needed.",
        "Add พูดช้าๆ ได้ไหม phûut cháa-cháa dâai mái to control conversation speed."
      ],
      "onScreenBullets": [
        "ไม่เข้าใจ | mâi khâo-jai | I do not understand",
        "พูดช้าๆ ได้ไหม | phûut cháa-cháa dâai mái | can you speak slowly?"
      ],
      "drills": [
        "Repeat repair phrase three times.",
        "Ask for slower speech politely."
      ],
      "languageFocus": [
        {
          "thai": "ไม่เข้าใจ",
          "translit": "mâi khâo-jai",
          "english": "I do not understand",
          "vocabId": "v-4dea1cee34"
        },
        {
          "thai": "พูดช้าๆ ได้ไหม",
          "translit": "phûut cháa-cháa dâai mái",
          "english": "can you speak slowly?",
          "vocabId": "v-6f22c219d9"
        }
      ]
    }
  ],
  "roleplay": {
    "scenario": "Fallback mini roleplay",
    "lines": [
      {
        "speaker": "A",
        "thai": "สวัสดี",
        "translit": "sà-wàt-dii",
        "english": "Hello."
      },
      {
        "speaker": "B",
        "thai": "สวัสดี",
        "translit": "sà-wàt-dii",
        "english": "Hello."
      },
      {
        "speaker": "A",
        "thai": "ขอบคุณ",
        "translit": "khàawp-khun",
        "english": "Thank you."
      },
      {
        "speaker": "B",
        "thai": "ไม่เข้าใจ",
        "translit": "mâi khâo-jai",
        "english": "I do not understand."
      }
    ]
  },
  "recap": [
    "Use polite greeting.",
    "Use thanks.",
    "Use repair phrase."
  ],
  "qaChecks": [
    {
      "id": "tone-inline",
      "description": "All transliteration uses PTM inline tone marks; superscripts forbidden",
      "pass": true,
      "evidence": "All transliteration strings passed inline-tone checks"
    },
    {
      "id": "triplets",
      "description": "Thai/translit/English triplets are complete for learner-facing script content",
      "pass": true,
      "evidence": "Sections and on-screen bullets contain complete triplets"
    },
    {
      "id": "drills",
      "description": "Each section includes active drill",
      "pass": true,
      "evidence": "Each section has >=1 drill"
    },
    {
      "id": "roleplay",
      "description": "Scenario roleplay included and substantial",
      "pass": true,
      "evidence": "Roleplay contains 4 lines"
    },
    {
      "id": "policy",
      "description": "Transliteration + image sourcing policies are declared",
      "pass": true,
      "evidence": "Policy object present with required enum values"
    }
  ],
  "policies": {
    "transliteration": "PTM_ADAPTED_INLINE_TONES",
    "imageSourcing": "INTERNET_FIRST_NO_GENERATIVE_DEFAULT"
  }
}
